{
  "id": "018f6b2e-9c4a-7b3e-a1d2-3f4e5d6c7b8c",
  "tenant_id": "018f6b10-0000-7000-8000-000000000002",
  "source_kind": "GEN_AVATAR",
  "content_hash": "sha256:11223344556677889900aabbccddeeff00112233445566778899aabbccddeeff",
  "storage_uri": "s3://media-gen/tenant-b/avatar/001.webm",
  "order_item_id": null,
  "probe": { "duration_frames": 250, "fps": 25, "w": 1080, "h": 1920 },
  "uploaded_at": "2026-08-10T08:00:00Z"
}
